{
  "action": "commerce.purchase",
  "actor": "did:web:agent.example",
  "audience": "https://tickets.example",
  "constraints": {
    "expected_runtime": "spiffe://agent.example/workload/ticket-agent",
    "max_amount": {
      "currency": "USD",
      "value": "45.00"
    },
    "payment": {
      "human_present": false,
      "mandate_id": "ap2hnp-20260507-stale-001",
      "merchant": "tickets.example",
      "psp_audience": "https://psp.example/ap2"
    }
  },
  "correlation": {
    "a2a_context_id": "ctx-ap2hnp-stale-20260507-001",
    "a2a_task_id": "task-ap2hnp-stale-20260507-001"
  },
  "evidence_refs": [
    {
      "digest": {
        "alg": "sha-256",
        "value": "867e5c25b5a54dae8a9d3c03d4f2cdb0332b562521e0c68f1e2dd43eb5636063"
      },
      "media_type": "application/ap2-mandate+json",
      "protocol_hint": "ap2_human_not_present",
      "type": "payment_mandate",
      "uri": "examples/interop/ap2-human-not-present-to-vate/ap2-hnp-mandate-stale.example.json"
    }
  ],
  "expires_at": "2026-05-07T10:05:00Z",
  "input_hash": "sha-256:fb6980fe15093698f942e85fff6c6fad3d5570266f47f10c35869bed7cfe2b78",
  "issued_at": "2026-05-07T10:00:00Z",
  "principal": "did:web:user.example",
  "profile": "VATE-AL2-Verifier-Admission-v0.2",
  "request_id": "areq-ap2hnp-stale-20260507-001",
  "runtime": "spiffe://agent.example/workload/ticket-agent",
  "target": {
    "audience": "https://tickets.example",
    "resource": "https://tickets.example/checkout/event-456"
  },
  "transaction_id": "txn-ap2hnp-stale-20260507-001",
  "version": "vate-0.2"
}
