{
  "action": "commerce.purchase",
  "actor": "did:web:agent.example",
  "audience": "https://tickets.example",
  "constraints": {
    "expected_runtime": "spiffe://agent.example/workload/ticket-agent",
    "max_amount": {
      "currency": "USD",
      "value": "125.00"
    },
    "payment": {
      "human_present": false,
      "mandate_id": "ap2hnp-20260507-overrun-001",
      "merchant": "tickets.example",
      "psp_audience": "https://psp.example/ap2"
    }
  },
  "correlation": {
    "a2a_context_id": "ctx-ap2hnp-overrun-20260507-001",
    "a2a_task_id": "task-ap2hnp-overrun-20260507-001"
  },
  "evidence_refs": [
    {
      "digest": {
        "alg": "sha-256",
        "value": "b8693fb237aeb61b19438a82ab678f2e37f6d1f4c524cdfaa54e128af0abf37b"
      },
      "media_type": "application/ap2-mandate+json",
      "protocol_hint": "ap2_human_not_present",
      "type": "payment_mandate",
      "uri": "examples/interop/ap2-human-not-present-to-vate/ap2-hnp-mandate-overrun.example.json"
    }
  ],
  "expires_at": "2026-05-07T10:05:00Z",
  "input_hash": "sha-256:7df33abc1344838c35cd5e36fe8c36bb2b954e3e307f2f48cd31928174aea848",
  "issued_at": "2026-05-07T10:00:00Z",
  "principal": "did:web:user.example",
  "profile": "VATE-AL2-Verifier-Admission-v0.2",
  "request_id": "areq-ap2hnp-overrun-20260507-001",
  "runtime": "spiffe://agent.example/workload/ticket-agent",
  "target": {
    "audience": "https://tickets.example",
    "resource": "https://tickets.example/checkout/event-456"
  },
  "transaction_id": "txn-ap2hnp-overrun-20260507-001",
  "version": "vate-0.2"
}
